<?xml version="1.0"?>
<!DOCTYPE Report
[
<!ELEMENT Report (General ,(Doc|BPT)) >
<!ATTLIST Report ver CDATA #REQUIRED tmZone CDATA #REQUIRED>

<!ELEMENT General ( DocLocation ) >
<!ATTLIST General productName CDATA #REQUIRED productVer CDATA #REQUIRED os CDATA #REQUIRED host CDATA #REQUIRED qcserver CDATA #IMPLIED qcproject CDATA #IMPLIED SolManSolutionId CDATA #IMPLIED SolManProjectId CDATA #IMPLIED SolManTestPlanId CDATA #IMPLIED SolManTestPackageId CDATA #IMPLIED SolManUserInfoData CDATA #IMPLIED  >

<!ELEMENT BPT (DName,Res,DVer?,TSet?,TInst?,NodeArgs,AdditionalInfo*,Doc*) >
<!ATTLIST BPT rID ID #REQUIRED >

<!ELEMENT Doc (DName,ConfName?,Res,DVer?,TSet?,TInst?,RunType?,DT?,AdditionalInfo*,Step*,DIter*,Step*,Action*,Doc*,Summary?,TestMaintenanceSummary*,NodeArgs?) >
<!ATTLIST Doc rID ID #REQUIRED type (Test|BC|BPTWrapperTest|Flow|Group|Action) "Test" productName CDATA #REQUIRED BCIter CDATA #IMPLIED >

<!ELEMENT RunType ( #PCDATA )>
<!ATTLIST RunType fmStep (False|True) "False" batch (False|True) "False" upDesc (False|True) "False" upChk (False|True) "False" upAS (False|True) "False">

<!ELEMENT DName ( #PCDATA ) >

<!ELEMENT ConfName ( #PCDATA ) >

<!ELEMENT Res ( #PCDATA ) >

<!ELEMENT AdditionalInfo (AdditionalDataName,AdditionalDataValue ) >

<!ELEMENT AdditionalDataName ( #PCDATA ) >

<!ELEMENT AdditionalDataValue ( #PCDATA ) >

<!ELEMENT DVer ( #PCDATA ) >

<!ELEMENT TSet ( #PCDATA ) >

<!ELEMENT TInst ( #PCDATA ) >

<!ELEMENT DIter (Step*,Action+,Summary?,NodeArgs)>
<!ATTLIST DIter rID ID #REQUIRED iterID CDATA #REQUIRED>

<!ELEMENT DocLocation ( #PCDATA )>

<!ELEMENT Action (AName,AIter*,(Step|HtmlStep|Action)*, Summary,ActionMaintenanceSummary*, NodeArgs ) >
<!ATTLIST Action rID ID #REQUIRED>

<!ELEMENT AIter ((Step|HtmlStep|Action)*,DataMapping?, Summary?,NodeArgs) >
<!ATTLIST AIter rID ID #REQUIRED iterID CDATA #REQUIRED isCountable (False|True) "False" >

<!ELEMENT AName ( #PCDATA ) >

<!ELEMENT TestMaintenanceSummary (ActionMaintenanceSummary*) >
<!ATTLIST TestMaintenanceSummary ObjectsAdded CDATA #REQUIRED ObjectsUpdated CDATA #REQUIRED StepsUpdated CDATA #REQUIRED StepsComments CDATA #REQUIRED><!ELEMENT ActionMaintenanceSummary (ObjectChange* ) >
<!ATTLIST ActionMaintenanceSummary Action CDATA #REQUIRED Objects CDATA #REQUIRED Updated CDATA #REQUIRED LinesTotal CDATA #REQUIRED Added CDATA #REQUIRED LinesUpdated CDATA #REQUIRED>

<!ELEMENT ObjectChange  (Hierarchy, PropertyChangeList* ) >
<!ATTLIST ObjectChange Operation CDATA #IMPLIED OriginalRepository CDATA #IMPLIED>

<!ELEMENT PropertyChangeList (PropertyDef*) >

<!ELEMENT PropertyDef (OriginalValue, NewValue) >
<!ATTLIST PropertyDef PropName CDATA #REQUIRED OriginRegularExpression (True|False) "False" NewRegularExpression (True|False) "False" AddedProperty (True|False) "False" >

<!ELEMENT OriginalValue ( #PCDATA )>

<!ELEMENT NewValue ( #PCDATA )>

<!ELEMENT Hierarchy  (ObjectName, Hierarchy*) >
<!ATTLIST Hierarchy MicClass CDATA #REQUIRED>

<!ELEMENT ObjectName  ( #PCDATA ) >

<!ELEMENT Step (Obj,Details,Time,TimeTick* ,(Step|HtmlStep|Doc)*, DataMapping?, NodeArgs) >
<!ATTLIST Step rID ID #REQUIRED retval CDATA #IMPLIED>

<!ELEMENT HtmlStep (HTML,TimeTick*,(Step|HtmlStep|Doc)*,NodeArgs) >
<!ATTLIST HtmlStep rID ID #REQUIRED >

<!ELEMENT Obj ( #PCDATA ) >
<!ATTLIST Obj plainTxt (False|True) "True">

<!ELEMENT Details ( #PCDATA ) >
<!ATTLIST Details plainTxt (False|True) "True">

<!ELEMENT Time ( #PCDATA ) >

<!ELEMENT HTML ( #PCDATA ) >

<!ELEMENT Disp ( #PCDATA ) >

<!ELEMENT TimeTick ( #PCDATA ) >

<!ELEMENT DataMapping ( DataMappedItem* )>
<!ELEMENT DataMappedItem EMPTY >
<!ATTLIST DataMappedItem dsName CDATA #REQUIRED >
<!ATTLIST DataMappedItem rowId CDATA #REQUIRED >

<!ELEMENT NodeArgs (Disp,TopPane?,BtmPane?,ExtendedInfo? )>
<!ATTLIST NodeArgs eType CDATA #REQUIRED icon CDATA #REQUIRED nRep CDATA #REQUIRED UserNote CDATA #IMPLIED filter (False|True) "True">
<!ATTLIST NodeArgs status (Passed|Failed|Done|Warning|Information) "Done">
<!ATTLIST NodeArgs iconSel CDATA #IMPLIED nType CDATA #IMPLIED MovieMarker CDATA "">
<!ATTLIST NodeArgs Source CDATA #IMPLIED SourceLine CDATA #IMPLIED StepFlowItemKey CDATA #IMPLIED >

<!ELEMENT TopPane (Path)>

<!ELEMENT BtmPane ( (Path|WR)?,ASHilite?)>
<!ATTLIST BtmPane vType CDATA "HTML">

<!ELEMENT Path ( #PCDATA ) >

<!ELEMENT ASHilite ( #PCDATA ) >

<!ELEMENT WR ( #PCDATA ) >

<!ELEMENT ExtendedInfo ( StepData ) >

<!ATTLIST ExtendedInfo StepType CDATA #REQUIRED>
<!ELEMENT DT (NodeArgs) >
<!ATTLIST DT rID ID #REQUIRED>

<!ELEMENT Summary (Param*)>
<!ATTLIST Summary sTime CDATA #IMPLIED eTime CDATA #IMPLIED passed CDATA #IMPLIED failed CDATA #IMPLIED warnings CDATA #IMPLIED retval CDATA #IMPLIED stopped (False|True) "False" >

<!ELEMENT Param (ParamName,ParamVal)+ >
<!ATTLIST Param paramInOut (In|Out) "In">

<!ELEMENT ParamName ( #PCDATA ) >

<!ELEMENT ParamVal ( #PCDATA ) >

]
>
<Report ver="2.0" tmZone="India Standard Time">
<General productName="HP Unified Functional Testing" productVer="12.01" os="Windows 7" host="HW1419"><DocLocation><![CDATA[C:\IFSAutomation\Branch_IFS_Documents_Final\Drivers\SuiteDriver]]></DocLocation></General>
<Doc rID="T1"   productName= "HP Unified Functional Testing"  >
<DName><![CDATA[SuiteDriver]]></DName>
<Res><![CDATA[Res245]]></Res>
<DT rID="T2">
<NodeArgs eType="Table" icon="2" nRep="4" filter="False" >
<Disp><![CDATA[Run-Time Data Table]]></Disp>
<BtmPane vType="Table" >
<Path><![CDATA[Default.xls]]></Path>
</BtmPane>
</NodeArgs>
</DT>
<Action rID="T3">
<AName><![CDATA[Action1]]></AName>
<Step rID="T4">
<Obj plainTxt="False" ><![CDATA[SystemUtil]]></Obj>
<Details plainTxt="False" ><![CDATA[SystemUtil]]></Details>
<Time><![CDATA[12-09-2016 - 11:57:26]]></Time>
<TimeTick>1473661646</TimeTick>
<Step rID="T5">
<Obj plainTxt="False" ><![CDATA[Run "iexplore.exe",3]]></Obj>
<Details plainTxt="False" ><![CDATA[Run "iexplore.exe",3]]></Details>
<Time><![CDATA[12-09-2016 - 11:57:26]]></Time>
<TimeTick>1473661646</TimeTick>
<NodeArgs eType="Replay" icon="4" nRep="10" status="Passed" >
<Disp><![CDATA[Run "iexplore.exe",3]]></Disp>
</NodeArgs>
</Step>
<NodeArgs eType="Replay" icon="4" nRep="9" status="Passed" >
<Disp><![CDATA[SystemUtil]]></Disp>
</NodeArgs>
</Step>
<Step rID="T6">
<Obj plainTxt="False" ><![CDATA[Login]]></Obj>
<Details plainTxt="False" ><![CDATA[Browser]]></Details>
<Time><![CDATA[12-09-2016 - 11:57:27]]></Time>
<TimeTick>1473661647</TimeTick>
<Step rID="T7">
<Obj plainTxt="False" ><![CDATA[Login]]></Obj>
<Details plainTxt="False" ><![CDATA[Cannot identify the object "Login" (of class Browser). Verify that this object's properties match an object currently displayed in your application.]]></Details>
<Time><![CDATA[12-09-2016 - 11:57:27]]></Time>
<TimeTick>1473661647</TimeTick>
<Step rID="T8">
<Obj plainTxt="False" ><![CDATA[Login]]></Obj>
<Details plainTxt="False" ><![CDATA[Object's physical description:<br>miccommentproperty = <br>Mercury Class = Browser<br>CreationTime = 0<br>|Title = Login - Windows Internet Explorer<br>openurl = http://www.msn.com/en-in/?cobrand=dell13.msn.com&ocid=DELLDHP&pc=MDDCJS<br>opentitle = <br>Opened By Testing Tool = 0<br>number of tabs = 1<br>Name = Login<br>]]></Details>
<Time><![CDATA[12-09-2016 - 11:57:27]]></Time>
<TimeTick>1473661647</TimeTick>
<NodeArgs eType="Replay" icon="6" nRep="22" status="Warning" nType="Description" >
<Disp><![CDATA[Login]]></Disp>
</NodeArgs>
</Step>
<NodeArgs eType="Replay" icon="5" nRep="21" status="Failed" nType="Run Error" >
<Disp><![CDATA[Login]]></Disp>
</NodeArgs>
</Step>
<NodeArgs eType="Context" icon="5" nRep="20" status="Failed" >
<Disp><![CDATA[Login]]></Disp>
</NodeArgs>
</Step>
<Step rID="T9">
<Obj plainTxt="False" ><![CDATA[Run Error]]></Obj>
<Details plainTxt="False" ><![CDATA[Cannot identify the object &quot;Login&quot; (of class Browser). Verify that this object's properties match an object currently displayed in your application.<BR>Function file: C:\IFSAutomation\Branch_IFS_Documents_Final\Libraries\GeneralLibraries\BusinessFunction.vbs<BR>Line (10): &quot;		Browser(&quot;Login&quot;).Page(&quot;Login&quot;).sync&quot;.]]></Details>
<Time><![CDATA[12-09-2016 - 11:57:27]]></Time>
<TimeTick>1473661647</TimeTick>
<NodeArgs eType="Replay" icon="6" nRep="23" status="Failed" Source="C:\IFSAutomation\Branch_IFS_Documents_Final\Libraries\GeneralLibraries\BusinessFunction.vbs" SourceLine="9" >
<Disp><![CDATA[Run Error]]></Disp>
</NodeArgs>
</Step>
<Step rID="T10">
<Obj ><![CDATA[Login]]></Obj>
<Details ><![CDATA[]]></Details>
<Time><![CDATA[12-09-2016 - 11:57:27]]></Time>
<TimeTick>1473661647</TimeTick>
<NodeArgs eType="User" icon="7" nRep="24" status="Passed" Source="C:\IFSAutomation\Branch_IFS_Documents_Final\Libraries\GeneralLibraries\BusinessFunction.vbs" SourceLine="-1" >
<Disp><![CDATA[Login]]></Disp>
</NodeArgs>
</Step>
<Step rID="T11">
<Obj plainTxt="False" ><![CDATA[Login]]></Obj>
<Details plainTxt="False" ><![CDATA[Browser]]></Details>
<Time><![CDATA[12-09-2016 - 11:57:45]]></Time>
<TimeTick>1473661665</TimeTick>
<Step rID="T12">
<Obj plainTxt="False" ><![CDATA[Login]]></Obj>
<Details plainTxt="False" ><![CDATA[Page]]></Details>
<Time><![CDATA[12-09-2016 - 11:57:45]]></Time>
<TimeTick>1473661665</TimeTick>
<Step rID="T13">
<Obj plainTxt="False" ><![CDATA[TXT_user_name.Exist]]></Obj>
<Details plainTxt="False" ><![CDATA["Object exists"]]></Details>
<Time><![CDATA[12-09-2016 - 11:57:45]]></Time>
<TimeTick>1473661665</TimeTick>
<NodeArgs eType="Replay" icon="9" nRep="28" Source="C:\IFSAutomation\Branch_IFS_Documents_Final\Libraries\GeneralLibraries\BusinessFunction.vbs" SourceLine="-1" >
<Disp><![CDATA[TXT_user_name.Exist]]></Disp>
</NodeArgs>
</Step>
<Step rID="T14">
<Obj plainTxt="False" ><![CDATA[TXT_user_name.Set]]></Obj>
<Details plainTxt="False" ><![CDATA["chrisj"]]></Details>
<Time><![CDATA[12-09-2016 - 11:57:45]]></Time>
<TimeTick>1473661665</TimeTick>
<NodeArgs eType="Replay" icon="9" nRep="30" Source="C:\IFSAutomation\Branch_IFS_Documents_Final\Libraries\GeneralLibraries\BusinessFunction.vbs" SourceLine="-1" >
<Disp><![CDATA[TXT_user_name.Set]]></Disp>
</NodeArgs>
</Step>
<NodeArgs eType="Context" icon="8" nRep="27" Source="C:\IFSAutomation\Branch_IFS_Documents_Final\Libraries\GeneralLibraries\BusinessFunction.vbs" SourceLine="-1" >
<Disp><![CDATA[Login]]></Disp>
</NodeArgs>
</Step>
<NodeArgs eType="Context" icon="5" nRep="26" Source="C:\IFSAutomation\Branch_IFS_Documents_Final\Libraries\GeneralLibraries\BusinessFunction.vbs" SourceLine="-1" >
<Disp><![CDATA[Login]]></Disp>
</NodeArgs>
</Step>
<Step rID="T15">
<Obj ><![CDATA[Login]]></Obj>
<Details ><![CDATA[]]></Details>
<Time><![CDATA[12-09-2016 - 11:57:45]]></Time>
<TimeTick>1473661665</TimeTick>
<NodeArgs eType="User" icon="7" nRep="31" status="Passed" Source="C:\IFSAutomation\Branch_IFS_Documents_Final\Libraries\GeneralLibraries\BusinessFunction.vbs" SourceLine="-1" >
<Disp><![CDATA[Login]]></Disp>
</NodeArgs>
</Step>
<Step rID="T16">
<Obj plainTxt="False" ><![CDATA[Login]]></Obj>
<Details plainTxt="False" ><![CDATA[Browser]]></Details>
<Time><![CDATA[12-09-2016 - 11:57:45]]></Time>
<TimeTick>1473661665</TimeTick>
<Step rID="T17">
<Obj plainTxt="False" ><![CDATA[Login]]></Obj>
<Details plainTxt="False" ><![CDATA[Page]]></Details>
<Time><![CDATA[12-09-2016 - 11:57:45]]></Time>
<TimeTick>1473661665</TimeTick>
<Step rID="T18">
<Obj plainTxt="False" ><![CDATA[TXT_user_password.Exist]]></Obj>
<Details plainTxt="False" ><![CDATA["Object exists"]]></Details>
<Time><![CDATA[12-09-2016 - 11:57:45]]></Time>
<TimeTick>1473661665</TimeTick>
<NodeArgs eType="Replay" icon="9" nRep="35" Source="C:\IFSAutomation\Branch_IFS_Documents_Final\Libraries\GeneralLibraries\BusinessFunction.vbs" SourceLine="-1" >
<Disp><![CDATA[TXT_user_password.Exist]]></Disp>
</NodeArgs>
</Step>
<Step rID="T19">
<Obj plainTxt="False" ><![CDATA[TXT_user_password.Set]]></Obj>
<Details plainTxt="False" ><![CDATA["password"]]></Details>
<Time><![CDATA[12-09-2016 - 11:57:45]]></Time>
<TimeTick>1473661665</TimeTick>
<NodeArgs eType="Replay" icon="9" nRep="37" Source="C:\IFSAutomation\Branch_IFS_Documents_Final\Libraries\GeneralLibraries\BusinessFunction.vbs" SourceLine="-1" >
<Disp><![CDATA[TXT_user_password.Set]]></Disp>
</NodeArgs>
</Step>
<NodeArgs eType="Context" icon="8" nRep="34" Source="C:\IFSAutomation\Branch_IFS_Documents_Final\Libraries\GeneralLibraries\BusinessFunction.vbs" SourceLine="-1" >
<Disp><![CDATA[Login]]></Disp>
</NodeArgs>
</Step>
<NodeArgs eType="Context" icon="5" nRep="33" Source="C:\IFSAutomation\Branch_IFS_Documents_Final\Libraries\GeneralLibraries\BusinessFunction.vbs" SourceLine="-1" >
<Disp><![CDATA[Login]]></Disp>
</NodeArgs>
</Step>
<Step rID="T20">
<Obj ><![CDATA[Login]]></Obj>
<Details ><![CDATA[]]></Details>
<Time><![CDATA[12-09-2016 - 11:57:45]]></Time>
<TimeTick>1473661665</TimeTick>
<NodeArgs eType="User" icon="7" nRep="38" status="Passed" Source="C:\IFSAutomation\Branch_IFS_Documents_Final\Libraries\GeneralLibraries\BusinessFunction.vbs" SourceLine="-1" >
<Disp><![CDATA[Login]]></Disp>
</NodeArgs>
</Step>
<Step rID="T21">
<Obj plainTxt="False" ><![CDATA[Login]]></Obj>
<Details plainTxt="False" ><![CDATA[Browser]]></Details>
<Time><![CDATA[12-09-2016 - 11:57:45]]></Time>
<TimeTick>1473661665</TimeTick>
<Step rID="T22">
<Obj plainTxt="False" ><![CDATA[Login]]></Obj>
<Details plainTxt="False" ><![CDATA[Page]]></Details>
<Time><![CDATA[12-09-2016 - 11:57:45]]></Time>
<TimeTick>1473661665</TimeTick>
<Step rID="T23">
<Obj plainTxt="False" ><![CDATA[BTN_Log In.Exist]]></Obj>
<Details plainTxt="False" ><![CDATA["Object exists"]]></Details>
<Time><![CDATA[12-09-2016 - 11:57:45]]></Time>
<TimeTick>1473661665</TimeTick>
<NodeArgs eType="Replay" icon="10" nRep="42" Source="C:\IFSAutomation\Branch_IFS_Documents_Final\Libraries\GeneralLibraries\BusinessFunction.vbs" SourceLine="-1" >
<Disp><![CDATA[BTN_Log In.Exist]]></Disp>
</NodeArgs>
</Step>
<Step rID="T24">
<Obj plainTxt="False" ><![CDATA[BTN_Log In.Click]]></Obj>
<Details plainTxt="False" ><![CDATA[]]></Details>
<Time><![CDATA[12-09-2016 - 11:57:48]]></Time>
<TimeTick>1473661668</TimeTick>
<NodeArgs eType="Replay" icon="10" nRep="44" Source="C:\IFSAutomation\Branch_IFS_Documents_Final\Libraries\GeneralLibraries\BusinessFunction.vbs" SourceLine="-1" >
<Disp><![CDATA[BTN_Log In.Click]]></Disp>
</NodeArgs>
</Step>
<NodeArgs eType="Context" icon="8" nRep="41" Source="C:\IFSAutomation\Branch_IFS_Documents_Final\Libraries\GeneralLibraries\BusinessFunction.vbs" SourceLine="-1" >
<Disp><![CDATA[Login]]></Disp>
</NodeArgs>
</Step>
<NodeArgs eType="Context" icon="5" nRep="40" Source="C:\IFSAutomation\Branch_IFS_Documents_Final\Libraries\GeneralLibraries\BusinessFunction.vbs" SourceLine="-1" >
<Disp><![CDATA[Login]]></Disp>
</NodeArgs>
</Step>
<Step rID="T25">
<Obj ><![CDATA[Login]]></Obj>
<Details ><![CDATA[]]></Details>
<Time><![CDATA[12-09-2016 - 11:57:48]]></Time>
<TimeTick>1473661668</TimeTick>
<NodeArgs eType="User" icon="7" nRep="45" status="Passed" Source="C:\IFSAutomation\Branch_IFS_Documents_Final\Libraries\GeneralLibraries\BusinessFunction.vbs" SourceLine="-1" >
<Disp><![CDATA[Login]]></Disp>
</NodeArgs>
</Step>
<Step rID="T26">
<Obj plainTxt="False" ><![CDATA[Work Queue]]></Obj>
<Details plainTxt="False" ><![CDATA[Browser]]></Details>
<Time><![CDATA[12-09-2016 - 11:57:54]]></Time>
<TimeTick>1473661674</TimeTick>
<Step rID="T27">
<Obj plainTxt="False" ><![CDATA[Work Queue]]></Obj>
<Details plainTxt="False" ><![CDATA[Page]]></Details>
<Time><![CDATA[12-09-2016 - 11:57:54]]></Time>
<TimeTick>1473661674</TimeTick>
<Step rID="T28">
<Obj plainTxt="False" ><![CDATA[TAB _Home.Exist]]></Obj>
<Details plainTxt="False" ><![CDATA["Object exists"]]></Details>
<Time><![CDATA[12-09-2016 - 11:57:54]]></Time>
<TimeTick>1473661674</TimeTick>
<NodeArgs eType="Replay" icon="11" nRep="49" Source="C:\IFSAutomation\Branch_IFS_Documents_Final\Libraries\GeneralLibraries\BusinessFunction.vbs" SourceLine="-1" >
<Disp><![CDATA[TAB _Home.Exist]]></Disp>
</NodeArgs>
</Step>
<Step rID="T29">
<Obj plainTxt="False" ><![CDATA[Work Queue.Sync]]></Obj>
<Details plainTxt="False" ><![CDATA[]]></Details>
<Time><![CDATA[12-09-2016 - 11:57:54]]></Time>
<TimeTick>1473661674</TimeTick>
<NodeArgs eType="Replay" icon="8" nRep="51" Source="C:\IFSAutomation\Branch_IFS_Documents_Final\Libraries\GeneralLibraries\BusinessFunction.vbs" SourceLine="-1" >
<Disp><![CDATA[Work Queue.Sync]]></Disp>
</NodeArgs>
</Step>
<Step rID="T30">
<Obj plainTxt="False" ><![CDATA[TAB _Home.Exist]]></Obj>
<Details plainTxt="False" ><![CDATA["Object exists"]]></Details>
<Time><![CDATA[12-09-2016 - 11:57:56]]></Time>
<TimeTick>1473661676</TimeTick>
<NodeArgs eType="Replay" icon="11" nRep="53" Source="C:\IFSAutomation\Branch_IFS_Documents_Final\Libraries\GeneralLibraries\BusinessFunction.vbs" SourceLine="-1" >
<Disp><![CDATA[TAB _Home.Exist]]></Disp>
</NodeArgs>
</Step>
<NodeArgs eType="Context" icon="8" nRep="48" Source="C:\IFSAutomation\Branch_IFS_Documents_Final\Libraries\GeneralLibraries\BusinessFunction.vbs" SourceLine="-1" >
<Disp><![CDATA[Work Queue]]></Disp>
</NodeArgs>
</Step>
<NodeArgs eType="Context" icon="5" nRep="47" Source="C:\IFSAutomation\Branch_IFS_Documents_Final\Libraries\GeneralLibraries\BusinessFunction.vbs" SourceLine="-1" >
<Disp><![CDATA[Work Queue]]></Disp>
</NodeArgs>
</Step>
<Step rID="T31">
<Obj ><![CDATA[Login]]></Obj>
<Details ><![CDATA[]]></Details>
<Time><![CDATA[12-09-2016 - 11:57:56]]></Time>
<TimeTick>1473661676</TimeTick>
<NodeArgs eType="User" icon="7" nRep="54" status="Passed" Source="C:\IFSAutomation\Branch_IFS_Documents_Final\Libraries\GeneralLibraries\BusinessFunction.vbs" SourceLine="-1" >
<Disp><![CDATA[Login]]></Disp>
</NodeArgs>
</Step>
<Step rID="T32">
<Obj plainTxt="False" ><![CDATA[Work Queue]]></Obj>
<Details plainTxt="False" ><![CDATA[Browser]]></Details>
<Time><![CDATA[12-09-2016 - 11:57:56]]></Time>
<TimeTick>1473661676</TimeTick>
<Step rID="T33">
<Obj plainTxt="False" ><![CDATA[Work Queue]]></Obj>
<Details plainTxt="False" ><![CDATA[Page]]></Details>
<Time><![CDATA[12-09-2016 - 11:57:56]]></Time>
<TimeTick>1473661676</TimeTick>
<Step rID="T34">
<Obj plainTxt="False" ><![CDATA[TAB_Tests.Exist]]></Obj>
<Details plainTxt="False" ><![CDATA["Object exists"]]></Details>
<Time><![CDATA[12-09-2016 - 11:57:56]]></Time>
<TimeTick>1473661676</TimeTick>
<NodeArgs eType="Replay" icon="11" nRep="58" >
<Disp><![CDATA[TAB_Tests.Exist]]></Disp>
</NodeArgs>
</Step>
<Step rID="T35">
<Obj plainTxt="False" ><![CDATA[TAB_Tests.Click]]></Obj>
<Details plainTxt="False" ><![CDATA[]]></Details>
<Time><![CDATA[12-09-2016 - 11:57:59]]></Time>
<TimeTick>1473661679</TimeTick>
<NodeArgs eType="Replay" icon="11" nRep="60" >
<Disp><![CDATA[TAB_Tests.Click]]></Disp>
</NodeArgs>
</Step>
<NodeArgs eType="Context" icon="8" nRep="57" >
<Disp><![CDATA[Work Queue]]></Disp>
</NodeArgs>
</Step>
<NodeArgs eType="Context" icon="5" nRep="56" >
<Disp><![CDATA[Work Queue]]></Disp>
</NodeArgs>
</Step>
<Step rID="T36">
<Obj ><![CDATA[NavigateToSmartyStreetTesting]]></Obj>
<Details ><![CDATA[]]></Details>
<Time><![CDATA[12-09-2016 - 11:57:59]]></Time>
<TimeTick>1473661679</TimeTick>
<NodeArgs eType="User" icon="7" nRep="61" status="Passed" >
<Disp><![CDATA[NavigateToSmartyStreetTesting]]></Disp>
</NodeArgs>
</Step>
<Step rID="T37">
<Obj plainTxt="False" ><![CDATA[Work Queue]]></Obj>
<Details plainTxt="False" ><![CDATA[Browser]]></Details>
<Time><![CDATA[12-09-2016 - 11:58:00]]></Time>
<TimeTick>1473661680</TimeTick>
<Step rID="T38">
<Obj plainTxt="False" ><![CDATA[Work Queue]]></Obj>
<Details plainTxt="False" ><![CDATA[Page]]></Details>
<Time><![CDATA[12-09-2016 - 11:58:00]]></Time>
<TimeTick>1473661680</TimeTick>
<Step rID="T39">
<Obj plainTxt="False" ><![CDATA[LNK_SmartyStreetsTesting.Exist]]></Obj>
<Details plainTxt="False" ><![CDATA["Object exists"]]></Details>
<Time><![CDATA[12-09-2016 - 11:58:00]]></Time>
<TimeTick>1473661680</TimeTick>
<NodeArgs eType="Replay" icon="11" nRep="65" >
<Disp><![CDATA[LNK_SmartyStreetsTesting.Exist]]></Disp>
</NodeArgs>
</Step>
<NodeArgs eType="Context" icon="8" nRep="64" >
<Disp><![CDATA[Work Queue]]></Disp>
</NodeArgs>
</Step>
<NodeArgs eType="Context" icon="5" nRep="63" >
<Disp><![CDATA[Work Queue]]></Disp>
</NodeArgs>
</Step>
<Step rID="T40">
<Obj ><![CDATA[NavigateToSmartyStreetTesting]]></Obj>
<Details ><![CDATA[]]></Details>
<Time><![CDATA[12-09-2016 - 11:58:00]]></Time>
<TimeTick>1473661680</TimeTick>
<NodeArgs eType="User" icon="7" nRep="66" status="Passed" >
<Disp><![CDATA[NavigateToSmartyStreetTesting]]></Disp>
</NodeArgs>
</Step>
<Step rID="T41">
<Obj plainTxt="False" ><![CDATA[Work Queue]]></Obj>
<Details plainTxt="False" ><![CDATA[Browser]]></Details>
<Time><![CDATA[12-09-2016 - 11:58:00]]></Time>
<TimeTick>1473661680</TimeTick>
<Step rID="T42">
<Obj plainTxt="False" ><![CDATA[Work Queue]]></Obj>
<Details plainTxt="False" ><![CDATA[Page]]></Details>
<Time><![CDATA[12-09-2016 - 11:58:00]]></Time>
<TimeTick>1473661680</TimeTick>
<Step rID="T43">
<Obj plainTxt="False" ><![CDATA[LNK_SmartyStreetsTesting.Exist]]></Obj>
<Details plainTxt="False" ><![CDATA["Object exists"]]></Details>
<Time><![CDATA[12-09-2016 - 11:58:00]]></Time>
<TimeTick>1473661680</TimeTick>
<NodeArgs eType="Replay" icon="11" nRep="70" >
<Disp><![CDATA[LNK_SmartyStreetsTesting.Exist]]></Disp>
</NodeArgs>
</Step>
<Step rID="T44">
<Obj plainTxt="False" ><![CDATA[LNK_SmartyStreetsTesting.Click]]></Obj>
<Details plainTxt="False" ><![CDATA[]]></Details>
<Time><![CDATA[12-09-2016 - 11:58:03]]></Time>
<TimeTick>1473661683</TimeTick>
<NodeArgs eType="Replay" icon="11" nRep="72" >
<Disp><![CDATA[LNK_SmartyStreetsTesting.Click]]></Disp>
</NodeArgs>
</Step>
<NodeArgs eType="Context" icon="8" nRep="69" >
<Disp><![CDATA[Work Queue]]></Disp>
</NodeArgs>
</Step>
<NodeArgs eType="Context" icon="5" nRep="68" >
<Disp><![CDATA[Work Queue]]></Disp>
</NodeArgs>
</Step>
<Step rID="T45">
<Obj ><![CDATA[NavigateToSmartyStreetTesting]]></Obj>
<Details ><![CDATA[]]></Details>
<Time><![CDATA[12-09-2016 - 11:58:03]]></Time>
<TimeTick>1473661683</TimeTick>
<NodeArgs eType="User" icon="7" nRep="73" status="Passed" >
<Disp><![CDATA[NavigateToSmartyStreetTesting]]></Disp>
</NodeArgs>
</Step>
<Step rID="T46">
<Obj plainTxt="False" ><![CDATA[SmartyStreetsTesting]]></Obj>
<Details plainTxt="False" ><![CDATA[Browser]]></Details>
<Time><![CDATA[12-09-2016 - 11:58:08]]></Time>
<TimeTick>1473661688</TimeTick>
<Step rID="T47">
<Obj plainTxt="False" ><![CDATA[SmartyStreetsTesting]]></Obj>
<Details plainTxt="False" ><![CDATA[Page]]></Details>
<Time><![CDATA[12-09-2016 - 11:58:08]]></Time>
<TimeTick>1473661688</TimeTick>
<Step rID="T48">
<Obj plainTxt="False" ><![CDATA[LBL_LegalAddress.Exist]]></Obj>
<Details plainTxt="False" ><![CDATA["Object exists"]]></Details>
<Time><![CDATA[12-09-2016 - 11:58:08]]></Time>
<TimeTick>1473661688</TimeTick>
<NodeArgs eType="Replay" icon="11" nRep="77" >
<Disp><![CDATA[LBL_LegalAddress.Exist]]></Disp>
</NodeArgs>
</Step>
<NodeArgs eType="Context" icon="8" nRep="76" >
<Disp><![CDATA[SmartyStreetsTesting]]></Disp>
</NodeArgs>
</Step>
<NodeArgs eType="Context" icon="5" nRep="75" >
<Disp><![CDATA[SmartyStreetsTesting]]></Disp>
</NodeArgs>
</Step>
<Step rID="T49">
<Obj ><![CDATA[VerifyReadOnlyValuesInSmartyStreets]]></Obj>
<Details ><![CDATA[]]></Details>
<Time><![CDATA[12-09-2016 - 11:58:08]]></Time>
<TimeTick>1473661688</TimeTick>
<NodeArgs eType="User" icon="7" nRep="78" status="Passed" >
<Disp><![CDATA[VerifyReadOnlyValuesInSmartyStreets]]></Disp>
</NodeArgs>
</Step>
<Step rID="T50">
<Obj plainTxt="False" ><![CDATA[SmartyStreetsTesting]]></Obj>
<Details plainTxt="False" ><![CDATA[Browser]]></Details>
<Time><![CDATA[12-09-2016 - 11:58:08]]></Time>
<TimeTick>1473661688</TimeTick>
<Step rID="T51">
<Obj plainTxt="False" ><![CDATA[SmartyStreetsTesting]]></Obj>
<Details plainTxt="False" ><![CDATA[Page]]></Details>
<Time><![CDATA[12-09-2016 - 11:58:08]]></Time>
<TimeTick>1473661688</TimeTick>
<Step rID="T52">
<Obj plainTxt="False" ><![CDATA[TXT_LA_Address.Exist]]></Obj>
<Details plainTxt="False" ><![CDATA["Object exists"]]></Details>
<Time><![CDATA[12-09-2016 - 11:58:08]]></Time>
<TimeTick>1473661688</TimeTick>
<NodeArgs eType="Replay" icon="9" nRep="82" >
<Disp><![CDATA[TXT_LA_Address.Exist]]></Disp>
</NodeArgs>
</Step>
<Step rID="T53">
<Obj plainTxt="False" ><![CDATA[TXT_LA_Address.Set]]></Obj>
<Details plainTxt="False" ><![CDATA["721 Jetton St"]]></Details>
<Time><![CDATA[12-09-2016 - 11:58:08]]></Time>
<TimeTick>1473661688</TimeTick>
<NodeArgs eType="Replay" icon="9" nRep="84" >
<Disp><![CDATA[TXT_LA_Address.Set]]></Disp>
</NodeArgs>
</Step>
<NodeArgs eType="Context" icon="8" nRep="81" >
<Disp><![CDATA[SmartyStreetsTesting]]></Disp>
</NodeArgs>
</Step>
<NodeArgs eType="Context" icon="5" nRep="80" >
<Disp><![CDATA[SmartyStreetsTesting]]></Disp>
</NodeArgs>
</Step>
<Step rID="T54">
<Obj ><![CDATA[VerifyReadOnlyValuesInSmartyStreets]]></Obj>
<Details ><![CDATA[]]></Details>
<Time><![CDATA[12-09-2016 - 11:58:08]]></Time>
<TimeTick>1473661688</TimeTick>
<NodeArgs eType="User" icon="7" nRep="85" status="Passed" >
<Disp><![CDATA[VerifyReadOnlyValuesInSmartyStreets]]></Disp>
</NodeArgs>
</Step>
<Step rID="T55">
<Obj plainTxt="False" ><![CDATA[SmartyStreetsTesting]]></Obj>
<Details plainTxt="False" ><![CDATA[Browser]]></Details>
<Time><![CDATA[12-09-2016 - 11:58:08]]></Time>
<TimeTick>1473661688</TimeTick>
<Step rID="T56">
<Obj plainTxt="False" ><![CDATA[SmartyStreetsTesting]]></Obj>
<Details plainTxt="False" ><![CDATA[Page]]></Details>
<Time><![CDATA[12-09-2016 - 11:58:08]]></Time>
<TimeTick>1473661688</TimeTick>
<Step rID="T57">
<Obj plainTxt="False" ><![CDATA[TXT_LA_City.Exist]]></Obj>
<Details plainTxt="False" ><![CDATA["Object exists"]]></Details>
<Time><![CDATA[12-09-2016 - 11:58:08]]></Time>
<TimeTick>1473661688</TimeTick>
<NodeArgs eType="Replay" icon="9" nRep="89" >
<Disp><![CDATA[TXT_LA_City.Exist]]></Disp>
</NodeArgs>
</Step>
<Step rID="T58">
<Obj plainTxt="False" ><![CDATA[TXT_LA_City.Object]]></Obj>
<Details plainTxt="False" ><![CDATA[]]></Details>
<Time><![CDATA[12-09-2016 - 11:58:08]]></Time>
<TimeTick>1473661688</TimeTick>
<NodeArgs eType="Replay" icon="9" nRep="90" >
<Disp><![CDATA[TXT_LA_City.Object]]></Disp>
</NodeArgs>
</Step>
<Step rID="T59">
<Obj plainTxt="False" ><![CDATA[TXT_LA_City.Set]]></Obj>
<Details plainTxt="False" ><![CDATA["Davidson"]]></Details>
<Time><![CDATA[12-09-2016 - 11:58:09]]></Time>
<TimeTick>1473661689</TimeTick>
<NodeArgs eType="Replay" icon="9" nRep="92" >
<Disp><![CDATA[TXT_LA_City.Set]]></Disp>
</NodeArgs>
</Step>
<NodeArgs eType="Context" icon="8" nRep="88" >
<Disp><![CDATA[SmartyStreetsTesting]]></Disp>
</NodeArgs>
</Step>
<NodeArgs eType="Context" icon="5" nRep="87" >
<Disp><![CDATA[SmartyStreetsTesting]]></Disp>
</NodeArgs>
</Step>
<Step rID="T60">
<Obj ><![CDATA[VerifyReadOnlyValuesInSmartyStreets]]></Obj>
<Details ><![CDATA[]]></Details>
<Time><![CDATA[12-09-2016 - 11:58:09]]></Time>
<TimeTick>1473661689</TimeTick>
<NodeArgs eType="User" icon="7" nRep="93" status="Passed" >
<Disp><![CDATA[VerifyReadOnlyValuesInSmartyStreets]]></Disp>
</NodeArgs>
</Step>
<Step rID="T61">
<Obj plainTxt="False" ><![CDATA[SmartyStreetsTesting]]></Obj>
<Details plainTxt="False" ><![CDATA[Browser]]></Details>
<Time><![CDATA[12-09-2016 - 11:58:09]]></Time>
<TimeTick>1473661689</TimeTick>
<Step rID="T62">
<Obj plainTxt="False" ><![CDATA[SmartyStreetsTesting]]></Obj>
<Details plainTxt="False" ><![CDATA[Page]]></Details>
<Time><![CDATA[12-09-2016 - 11:58:09]]></Time>
<TimeTick>1473661689</TimeTick>
<Step rID="T63">
<Obj plainTxt="False" ><![CDATA[TXT_LA_State.Exist]]></Obj>
<Details plainTxt="False" ><![CDATA["Object exists"]]></Details>
<Time><![CDATA[12-09-2016 - 11:58:09]]></Time>
<TimeTick>1473661689</TimeTick>
<NodeArgs eType="Replay" icon="9" nRep="97" >
<Disp><![CDATA[TXT_LA_State.Exist]]></Disp>
</NodeArgs>
</Step>
<Step rID="T64">
<Obj plainTxt="False" ><![CDATA[TXT_LA_State.Object]]></Obj>
<Details plainTxt="False" ><![CDATA[]]></Details>
<Time><![CDATA[12-09-2016 - 11:58:09]]></Time>
<TimeTick>1473661689</TimeTick>
<NodeArgs eType="Replay" icon="9" nRep="98" >
<Disp><![CDATA[TXT_LA_State.Object]]></Disp>
</NodeArgs>
</Step>
<Step rID="T65">
<Obj plainTxt="False" ><![CDATA[TXT_LA_State.Set]]></Obj>
<Details plainTxt="False" ><![CDATA["NC"]]></Details>
<Time><![CDATA[12-09-2016 - 11:58:09]]></Time>
<TimeTick>1473661689</TimeTick>
<NodeArgs eType="Replay" icon="9" nRep="100" >
<Disp><![CDATA[TXT_LA_State.Set]]></Disp>
</NodeArgs>
</Step>
<NodeArgs eType="Context" icon="8" nRep="96" >
<Disp><![CDATA[SmartyStreetsTesting]]></Disp>
</NodeArgs>
</Step>
<NodeArgs eType="Context" icon="5" nRep="95" >
<Disp><![CDATA[SmartyStreetsTesting]]></Disp>
</NodeArgs>
</Step>
<Step rID="T66">
<Obj ><![CDATA[VerifyReadOnlyValuesInSmartyStreets]]></Obj>
<Details ><![CDATA[]]></Details>
<Time><![CDATA[12-09-2016 - 11:58:09]]></Time>
<TimeTick>1473661689</TimeTick>
<NodeArgs eType="User" icon="7" nRep="101" status="Passed" >
<Disp><![CDATA[VerifyReadOnlyValuesInSmartyStreets]]></Disp>
</NodeArgs>
</Step>
<Step rID="T67">
<Obj plainTxt="False" ><![CDATA[SmartyStreetsTesting]]></Obj>
<Details plainTxt="False" ><![CDATA[Browser]]></Details>
<Time><![CDATA[12-09-2016 - 11:58:09]]></Time>
<TimeTick>1473661689</TimeTick>
<Step rID="T68">
<Obj plainTxt="False" ><![CDATA[SmartyStreetsTesting]]></Obj>
<Details plainTxt="False" ><![CDATA[Page]]></Details>
<Time><![CDATA[12-09-2016 - 11:58:09]]></Time>
<TimeTick>1473661689</TimeTick>
<Step rID="T69">
<Obj plainTxt="False" ><![CDATA[TXT_LA_Zip.Exist]]></Obj>
<Details plainTxt="False" ><![CDATA["Object exists"]]></Details>
<Time><![CDATA[12-09-2016 - 11:58:09]]></Time>
<TimeTick>1473661689</TimeTick>
<NodeArgs eType="Replay" icon="9" nRep="105" >
<Disp><![CDATA[TXT_LA_Zip.Exist]]></Disp>
</NodeArgs>
</Step>
<Step rID="T70">
<Obj plainTxt="False" ><![CDATA[TXT_LA_Zip.Object]]></Obj>
<Details plainTxt="False" ><![CDATA[]]></Details>
<Time><![CDATA[12-09-2016 - 11:58:09]]></Time>
<TimeTick>1473661689</TimeTick>